<!ELEMENT matricula (ciclo,alumnos)>
<!ELEMENT ciclo (#PCDATA)>
<!ELEMENT alumnos (alumno)+>
<!ELEMENT alumno (nombre,year,asignaturas)>
<!ATTLIST alumno nacionalidad CDATA #FIXED "EspaÃ±ola">
<!ELEMENT nombre (#PCDATA)>
<!ELEMENT year (#PCDATA)>
<!ELEMENT asignaturas (asignatura)+>
<!ELEMENT asignatura (#PCDATA)>